{
  "schema_version": "visual-variant-record.v1",
  "export_id": "export_20260814T165501Z",
  "minecraft_version": "26.2",
  "variant_id": "minecraft:stone",
  "block_id": "minecraft:stone",
  "canonical_state_id": "minecraft:stone",
  "represented_state_ids": ["minecraft:stone"],
  "context": {
    "fixture_id": "isolated",
    "fixture_version": "fixture.v1",
    "rotatable": true,
    "canonical_orientation": null
  },
  "selection": {
    "state_policy_version": "state-policy.v1",
    "reason": "default",
    "protected_dimensions": [],
    "folded_state_ids": [],
    "policy_override_id": null
  },
  "machine_facts": {
    "geometry": {
      "geometry_signature": "sha256:0000000000000000000000000000000000000000000000000000000000000000",
      "collision_signature": "sha256:0000000000000000000000000000000000000000000000000000000000000000",
      "shape": {
        "boxes": [],
        "signature": "sha256:0000000000000000000000000000000000000000000000000000000000000000"
      },
      "collision": {
        "boxes": [],
        "signature": "sha256:0000000000000000000000000000000000000000000000000000000000000000"
      },
      "width": 1,
      "height": 1,
      "depth": 1,
      "occupied_volume": 1,
      "is_full_cube": true,
      "is_horizontal_sheet": false,
      "geometry_classes": ["full_cube"],
      "feature_extractor_version": "feature.v1",
      "feature_input_sha256": "sha256:0000000000000000000000000000000000000000000000000000000000000000"
    },
    "behavior_fingerprint": "sha256:0000000000000000000000000000000000000000000000000000000000000000",
    "behavior_by_state": {
      "minecraft:stone": {
        "transparent": false,
        "emissive": false,
        "emission_level": 0,
        "passable": false,
        "waterloggable": false,
        "requires_support": false,
        "redstone_related": false,
        "support": {
          "above": false,
          "below": true,
          "east": false,
          "north": false,
          "south": false,
          "west": false,
          "none": true
        }
      }
    },
    "machine_tags": []
  },
  "render": {
    "render_policy_version": "render.v2",
    "preview_path": "renders/minecraft/stone/preview.png",
    "mask_path": "renders/minecraft/stone/mask.png",
    "render_metadata_path": "renders/minecraft/stone/render.json",
    "image_sha256": "sha256:0000000000000000000000000000000000000000000000000000000000000000",
    "mask_sha256": "sha256:0000000000000000000000000000000000000000000000000000000000000000",
    "render_metadata_sha256": "sha256:0000000000000000000000000000000000000000000000000000000000000000"
  },
  "annotation_refs": [],
  "override_refs": [],
  "qualification_review_refs": [],
  "candidate_qualification": "eligible",
  "warnings": [],
  "source": {
    "type": "machine",
    "minecraft_version": "26.2",
    "export_id": "export_20260814T165501Z",
    "producer_version": "1.0.0",
    "stage": "RENDER_VARIANTS"
  }
}
